{
  "experimentAssignmentVersion": "1",
  "status": "approved",
  "assignmentSchema": "../../schema/experiment-assignment/v1/assignment.schema.json",
  "canonicalFixture": "../../fixtures/experiment-assignment/v1/running-ab.json",
  "conformanceFixture": "../../fixtures/experiment-assignment/v1/assignment-vectors.json",
  "features": [
    "allocation.ranges",
    "assignment.installation",
    "assignment.identified_user",
    "assignment.identified_user_or_installation",
    "fallback.normal_placement",
    "group.mutual_exclusion",
    "override.qa",
    "schedule.trusted_server_time"
  ],
  "algorithms": [
    "experiment_sha256_length_prefixed_v1",
    "experiment_group_sha256_length_prefixed_v1"
  ],
  "schedulePolicies": [
    "trusted_server_time_v1"
  ],
  "readerPolicy": {
    "unknownVersion": "rejectCandidate",
    "unknownField": "rejectCandidate",
    "unsupportedFeature": "rejectCandidate",
    "unsupportedAlgorithm": "rejectCandidate",
    "malformedAllocation": "rejectCandidate",
    "ineligibleOrInactive": "normalPlacement",
    "partialEvaluation": "forbidden"
  }
}
